{"id":"watkins-glen","name":"Watkins Glen International","geometry_source":"julesr0y/f1-circuits-svg@9c93759b076d1b87eac265a009b21b399253220a/circuits/minimal/black/watkins-glen-3.svg","layout_id":"watkins-glen-3","capability":"synthetic_simulation","track_length_m":3746.381,"altitude_m":0,"track_clearance_m":{"value":25,"provenance":"assumed","note":"Assumed exclusion around unreferenced visual track artwork"},"frame":{"origin_lat":0,"origin_lon":0,"track_bounds_m":[501.565,1200],"venue_bounds_m":[-205,-205,706.565,1405]}}
