{"id":"caesars-palace","name":"Caesars Palace","geometry_source":"julesr0y/f1-circuits-svg@9c93759b076d1b87eac265a009b21b399253220a/circuits/minimal/black/caesars-palace-1.svg","layout_id":"caesars-palace-1","capability":"synthetic_simulation","track_length_m":8068.292,"altitude_m":0,"track_clearance_m":{"value":25,"provenance":"assumed","note":"Assumed exclusion around unreferenced visual track artwork"},"frame":{"origin_lat":0,"origin_lon":0,"track_bounds_m":[1200,1166.616],"venue_bounds_m":[-205,-205,1405,1371.616]}}
