{"id":"sebring","name":"Sebring International Raceway","geometry_source":"julesr0y/f1-circuits-svg@9c93759b076d1b87eac265a009b21b399253220a/circuits/minimal/black/sebring-1.svg","layout_id":"sebring-1","capability":"synthetic_simulation","track_length_m":6446.291,"altitude_m":0,"track_clearance_m":{"value":25,"provenance":"assumed","note":"Assumed exclusion around unreferenced visual track artwork"},"frame":{"origin_lat":0,"origin_lon":0,"track_bounds_m":[1194.175,1200],"venue_bounds_m":[-205,-205,1399.175,1405]}}
