{"id":"villeneuve","name":"Circuit Gilles Villeneuve","geometry_source":"julesr0y/f1-circuits-svg@9c93759b076d1b87eac265a009b21b399253220a/circuits/minimal/black/montreal-6.svg","layout_id":"montreal-6","capability":"synthetic_simulation","track_length_m":2728.488,"altitude_m":0,"track_clearance_m":{"value":25,"provenance":"assumed","note":"Assumed exclusion around unreferenced visual track artwork"},"frame":{"origin_lat":0,"origin_lon":0,"track_bounds_m":[388.99,1200],"venue_bounds_m":[-205,-205,593.99,1405]}}
