{"id":"buenos-aires","name":"Autódromo Juan y Oscar Gálvez","geometry_source":"julesr0y/f1-circuits-svg@9c93759b076d1b87eac265a009b21b399253220a/circuits/minimal/black/buenos-aires-4.svg","layout_id":"buenos-aires-4","capability":"synthetic_simulation","track_length_m":6339.856,"altitude_m":0,"track_clearance_m":{"value":25,"provenance":"assumed","note":"Assumed exclusion around unreferenced visual track artwork"},"frame":{"origin_lat":0,"origin_lon":0,"track_bounds_m":[1200,1168.64],"venue_bounds_m":[-205,-205,1405,1373.64]}}
